{
  "$schema": "https://json-schema.org/draft/2020-12/schema",
  "$id": "https://boxlite.ai/schemas/diagram-evidence-v1.json",
  "title": "BoxLite diagram evidence",
  "type": "object",
  "additionalProperties": false,
  "required": ["schema_version", "context", "states", "nodes", "edges", "annotations"],
  "properties": {
    "schema_version": { "const": 1 },
    "views": {
      "type": "array",
      "minItems": 1,
      "items": { "enum": ["architecture", "sequence", "call_graph"] },
      "uniqueItems": true
    },
    "topics": {
      "type": "array",
      "minItems": 1,
      "uniqueItems": true,
      "items": {
        "type": "object",
        "additionalProperties": false,
        "required": ["id", "question"],
        "properties": {
          "id": { "$ref": "#/$defs/id" },
          "question": { "type": "string", "minLength": 1 },
          "parent": { "$ref": "#/$defs/id" }
        }
      }
    },
    "context": {
      "type": "object",
      "additionalProperties": false,
      "required": ["kind", "change_kind", "sources"],
      "properties": {
        "kind": {
          "enum": ["overview", "issue", "pr", "commit", "branch", "working-tree-change"]
        },
        "change_kind": { "enum": ["none", "bug", "feature", "refactor", "docs"] },
        "sources": {
          "type": "object",
          "additionalProperties": false,
          "properties": {
            "repository": { "type": "string", "minLength": 1 },
            "issue": { "type": "integer", "minimum": 1 },
            "pr": { "type": "integer", "minimum": 1 },
            "base_revision": { "type": "string", "minLength": 1 },
            "head_revision": { "type": "string", "minLength": 1 }
          }
        }
      }
    },
    "states": {
      "type": "array",
      "minItems": 1,
      "maxItems": 2,
      "items": {
        "type": "object",
        "additionalProperties": false,
        "required": ["id", "label", "revision", "proposed"],
        "properties": {
          "id": { "$ref": "#/$defs/id" },
          "label": { "type": "string", "minLength": 1 },
          "revision": { "type": "string", "minLength": 1 },
          "proposed": { "type": "boolean" }
        }
      }
    },
    "nodes": {
      "type": "array",
      "minItems": 1,
      "items": {
        "allOf": [{ "$ref": "#/$defs/item" }],
        "unevaluatedProperties": false
      }
    },
    "edges": {
      "type": "array",
      "items": {
        "allOf": [
          { "$ref": "#/$defs/item" },
          {
            "type": "object",
            "required": ["from", "to", "kind"],
            "properties": {
              "from": { "$ref": "#/$defs/id" },
              "to": { "$ref": "#/$defs/id" },
              "kind": {
                "enum": ["call", "rpc", "dispatch", "spawn", "data", "state-transition", "proposed"]
              }
            }
          }
        ],
        "unevaluatedProperties": false
      }
    },
    "boundaries": {
      "type": "array",
      "items": {
        "allOf": [
          { "$ref": "#/$defs/item" },
          {
            "type": "object",
            "required": ["members"],
            "properties": {
              "members": {
                "type": "array",
                "minItems": 1,
                "items": { "$ref": "#/$defs/membership" }
              },
              "scope": {
                "enum": ["external", "edge", "compute", "execution", "state", "observability"]
              }
            }
          }
        ],
        "unevaluatedProperties": false
      }
    },
    "annotations": {
      "type": "array",
      "items": {
        "type": "object",
        "additionalProperties": false,
        "required": ["kind", "target", "state", "text"],
        "properties": {
          "kind": { "enum": ["ISSUE", "BUG", "FIX", "PROPOSED", "ADDED", "CHANGED", "REMOVED"] },
          "target": { "type": "string", "pattern": "^(node|edge):[a-z][a-z0-9_]*$" },
          "state": { "$ref": "#/$defs/id" },
          "text": { "type": "string", "minLength": 1 }
        }
      }
    }
  },
  "$defs": {
    "id": { "type": "string", "pattern": "^[a-z][a-z0-9_]*$" },
    "item": {
      "type": "object",
      "required": ["id", "label", "states", "views", "proposed", "evidence"],
      "properties": {
        "id": { "$ref": "#/$defs/id" },
        "label": { "type": "string", "minLength": 1 },
        "states": {
          "type": "array",
          "minItems": 1,
          "items": { "$ref": "#/$defs/id" },
          "uniqueItems": true
        },
        "views": {
          "type": "array",
          "minItems": 1,
          "items": { "enum": ["architecture", "sequence", "call_graph"] },
          "uniqueItems": true
        },
        "topics": {
          "type": "array",
          "minItems": 1,
          "items": { "$ref": "#/$defs/id" },
          "uniqueItems": true
        },
        "proposed": { "type": "boolean" },
        "evidence": {
          "type": "array",
          "items": {
            "oneOf": [
              { "$ref": "#/$defs/sourceEvidence" },
              { "$ref": "#/$defs/issueEvidence" }
            ]
          }
        }
      }
    },
    "sourceEvidence": {
      "type": "object",
      "additionalProperties": false,
      "required": ["type", "state", "revision", "path", "line_start", "line_end", "symbol", "tokens"],
      "properties": {
        "type": { "const": "source" },
        "state": { "$ref": "#/$defs/id" },
        "revision": { "type": "string", "minLength": 1 },
        "path": { "type": "string", "minLength": 1 },
        "line_start": { "type": "integer", "minimum": 1 },
        "line_end": { "type": "integer", "minimum": 1 },
        "symbol": { "type": "string", "minLength": 1 },
        "tokens": {
          "type": "array",
          "minItems": 1,
          "items": { "type": "string", "minLength": 1 }
        }
      }
    },
    "issueEvidence": {
      "type": "object",
      "additionalProperties": false,
      "required": ["type", "state", "issue", "tokens"],
      "properties": {
        "type": { "const": "issue" },
        "state": { "$ref": "#/$defs/id" },
        "issue": { "type": "integer", "minimum": 1 },
        "tokens": {
          "type": "array",
          "minItems": 1,
          "items": { "type": "string", "minLength": 1 }
        }
      }
    },
    "membership": {
      "type": "object",
      "additionalProperties": false,
      "required": ["target", "states"],
      "properties": {
        "target": {
          "type": "string",
          "pattern": "^(node|boundary):[a-z][a-z0-9_]*$"
        },
        "states": {
          "type": "array",
          "minItems": 1,
          "items": { "$ref": "#/$defs/id" },
          "uniqueItems": true
        },
        "topics": {
          "type": "array",
          "minItems": 1,
          "items": { "$ref": "#/$defs/id" },
          "uniqueItems": true
        }
      }
    }
  }
}
