{
 "schema_version": 1,
 "context": {
  "kind": "overview",
  "change_kind": "none",
  "sources": {
   "repository": "boxlite-ai/boxlite",
   "head_revision": "5b3321c7ade4d2e7bed7350c7f054d437035fa9e"
  }
 },
 "views": [
  "architecture"
 ],
 "topics": [
  {
   "id": "overview",
   "question": "How one BoxLite engine runs boxes on your machine and in your own cloud"
  },
  {
   "id": "local_machine",
   "question": "How the BoxLite engine on your machine turns a call into a container in its own micro-VM",
   "parent": "overview"
  }
 ],
 "states": [
  {
   "id": "current",
   "label": "Current",
   "revision": "5b3321c7ade4d2e7bed7350c7f054d437035fa9e",
   "proposed": false
  }
 ],
 "nodes": [
  {
   "id": "clients",
   "label": "Browser, SDK or CLI",
   "states": [
    "current"
   ],
   "views": [
    "architecture"
   ],
   "topics": [
    "overview"
   ],
   "proposed": false,
   "evidence": [
    {
     "type": "source",
     "state": "current",
     "revision": "5b3321c7ade4d2e7bed7350c7f054d437035fa9e",
     "path": "apps/infra/docs/aws/architecture.md",
     "line_start": 21,
     "line_end": 22,
     "symbol": "Browser",
     "tokens": [
      "browser([\"Browser\"])",
      "sdk([\"SDK / CLI\"])"
     ]
    }
   ]
  },
  {
   "id": "idp",
   "label": "OIDC identity provider",
   "states": [
    "current"
   ],
   "views": [
    "architecture"
   ],
   "topics": [
    "overview"
   ],
   "proposed": false,
   "evidence": [
    {
     "type": "source",
     "state": "current",
     "revision": "5b3321c7ade4d2e7bed7350c7f054d437035fa9e",
     "path": "apps/infra/docs/aws/architecture.md",
     "line_start": 23,
     "line_end": 23,
     "symbol": "idp",
     "tokens": [
      "OIDC identity provider"
     ]
    }
   ]
  },
  {
   "id": "local_runtime",
   "label": "Embedded BoxLite runtime",
   "states": [
    "current"
   ],
   "views": [
    "architecture"
   ],
   "topics": [
    "overview"
   ],
   "proposed": false,
   "evidence": [
    {
     "type": "source",
     "state": "current",
     "revision": "5b3321c7ade4d2e7bed7350c7f054d437035fa9e",
     "path": "README.md",
     "line_start": 31,
     "line_end": 31,
     "symbol": "Daemonless",
     "tokens": [
      "embed as a library"
     ]
    },
    {
     "type": "source",
     "state": "current",
     "revision": "5b3321c7ade4d2e7bed7350c7f054d437035fa9e",
     "path": "README.md",
     "line_start": 116,
     "line_end": 116,
     "symbol": "runtime",
     "tokens": [
      "runtime embedded"
     ]
    },
    {
     "type": "source",
     "state": "current",
     "revision": "5b3321c7ade4d2e7bed7350c7f054d437035fa9e",
     "path": "README.md",
     "line_start": 124,
     "line_end": 124,
     "symbol": "serve",
     "tokens": [
      "boxlite serve"
     ]
    }
   ]
  },
  {
   "id": "local_boxes",
   "label": "Box micro-VMs",
   "states": [
    "current"
   ],
   "views": [
    "architecture"
   ],
   "topics": [
    "overview"
   ],
   "proposed": false,
   "evidence": [
    {
     "type": "source",
     "state": "current",
     "revision": "5b3321c7ade4d2e7bed7350c7f054d437035fa9e",
     "path": "README.md",
     "line_start": 163,
     "line_end": 163,
     "symbol": "VM",
     "tokens": [
      "a hardware-virtualized VM per box (KVM / Hypervisor.framework)"
     ]
    }
   ]
  },
  {
   "id": "edge_lb",
   "label": "Load balancers",
   "states": [
    "current"
   ],
   "views": [
    "architecture"
   ],
   "topics": [
    "overview"
   ],
   "proposed": false,
   "evidence": [
    {
     "type": "source",
     "state": "current",
     "revision": "5b3321c7ade4d2e7bed7350c7f054d437035fa9e",
     "path": "apps/infra/mdeploy/stack/edge.ts",
     "line_start": 13,
     "line_end": 13,
     "symbol": "balancer",
     "tokens": [
      "TLS terminates at the *balancer* on both clouds"
     ]
    },
    {
     "type": "source",
     "state": "current",
     "revision": "5b3321c7ade4d2e7bed7350c7f054d437035fa9e",
     "path": "apps/infra/docs/aws/architecture.md",
     "line_start": 27,
     "line_end": 28,
     "symbol": "alb",
     "tokens": [
      "Application Load Balancer",
      "Network Load Balancer"
     ]
    }
   ]
  },
  {
   "id": "api",
   "label": "API + dashboard",
   "states": [
    "current"
   ],
   "views": [
    "architecture"
   ],
   "topics": [
    "overview"
   ],
   "proposed": false,
   "evidence": [
    {
     "type": "source",
     "state": "current",
     "revision": "5b3321c7ade4d2e7bed7350c7f054d437035fa9e",
     "path": "apps/infra/mdeploy/stack/api.ts",
     "line_start": 2,
     "line_end": 2,
     "symbol": "workload",
     "tokens": [
      "The control plane: the one workload that answers a request from outside."
     ]
    },
    {
     "type": "source",
     "state": "current",
     "revision": "5b3321c7ade4d2e7bed7350c7f054d437035fa9e",
     "path": "apps/infra/docs/aws/architecture.md",
     "line_start": 31,
     "line_end": 31,
     "symbol": "api",
     "tokens": [
      "API + bundled dashboard"
     ]
    }
   ]
  },
  {
   "id": "proxy",
   "label": "Box proxy",
   "states": [
    "current"
   ],
   "views": [
    "architecture"
   ],
   "topics": [
    "overview"
   ],
   "proposed": false,
   "evidence": [
    {
     "type": "source",
     "state": "current",
     "revision": "5b3321c7ade4d2e7bed7350c7f054d437035fa9e",
     "path": "apps/infra/mdeploy/stack/edge.ts",
     "line_start": 2,
     "line_end": 2,
     "symbol": "proxy",
     "tokens": [
      "The box proxy: how a port inside a box becomes a hostname on the internet."
     ]
    },
    {
     "type": "source",
     "state": "current",
     "revision": "5b3321c7ade4d2e7bed7350c7f054d437035fa9e",
     "path": "apps/proxy/README.md",
     "line_start": 3,
     "line_end": 3,
     "symbol": "proxy",
     "tokens": [
      "authorizes box access through the control plane",
      "tunnels traffic"
     ]
    }
   ]
  },
  {
   "id": "runner",
   "label": "Runner",
   "states": [
    "current"
   ],
   "views": [
    "architecture"
   ],
   "topics": [
    "overview"
   ],
   "proposed": false,
   "evidence": [
    {
     "type": "source",
     "state": "current",
     "revision": "5b3321c7ade4d2e7bed7350c7f054d437035fa9e",
     "path": "apps/runner/README.md",
     "line_start": 13,
     "line_end": 13,
     "symbol": "KVM",
     "tokens": [
      "Cloud deployment runs on Compute Engine or EC2 with nested KVM"
     ]
    },
    {
     "type": "source",
     "state": "current",
     "revision": "5b3321c7ade4d2e7bed7350c7f054d437035fa9e",
     "path": "apps/runner/README.md",
     "line_start": 25,
     "line_end": 25,
     "symbol": "runtime",
     "tokens": [
      "the embedded BoxLite runtime"
     ]
    }
   ]
  },
  {
   "id": "cloud_boxes",
   "label": "Box micro-VMs",
   "states": [
    "current"
   ],
   "views": [
    "architecture"
   ],
   "topics": [
    "overview"
   ],
   "proposed": false,
   "evidence": [
    {
     "type": "source",
     "state": "current",
     "revision": "5b3321c7ade4d2e7bed7350c7f054d437035fa9e",
     "path": "apps/infra/mdeploy/stack/runners.ts",
     "line_start": 6,
     "line_end": 6,
     "symbol": "microVM",
     "tokens": [
      "box is a microVM under KVM"
     ]
    }
   ]
  },
  {
   "id": "cloud_state",
   "label": "PostgreSQL · Redis",
   "states": [
    "current"
   ],
   "views": [
    "architecture"
   ],
   "topics": [
    "overview"
   ],
   "proposed": false,
   "evidence": [
    {
     "type": "source",
     "state": "current",
     "revision": "5b3321c7ade4d2e7bed7350c7f054d437035fa9e",
     "path": "apps/infra/mdeploy/stack/database.ts",
     "line_start": 2,
     "line_end": 2,
     "symbol": "PostgreSQL",
     "tokens": [
      "managed PostgreSQL"
     ]
    },
    {
     "type": "source",
     "state": "current",
     "revision": "5b3321c7ade4d2e7bed7350c7f054d437035fa9e",
     "path": "apps/infra/mdeploy/stack/cache.ts",
     "line_start": 2,
     "line_end": 2,
     "symbol": "cache",
     "tokens": [
      "The transient cache the control plane keeps its queues and sessions in."
     ]
    },
    {
     "type": "source",
     "state": "current",
     "revision": "5b3321c7ade4d2e7bed7350c7f054d437035fa9e",
     "path": "apps/infra/docs/aws/architecture.md",
     "line_start": 36,
     "line_end": 36,
     "symbol": "redis",
     "tokens": [
      "ElastiCache Redis"
     ]
    },
    {
     "type": "source",
     "state": "current",
     "revision": "5b3321c7ade4d2e7bed7350c7f054d437035fa9e",
     "path": "apps/infra/mdeploy/stack/storage.ts",
     "line_start": 2,
     "line_end": 2,
     "symbol": "store",
     "tokens": [
      "The object store boxes keep their volumes in."
     ]
    }
   ]
  },
  {
   "id": "http_client",
   "label": "HTTP client",
   "states": [
    "current"
   ],
   "views": [
    "architecture"
   ],
   "topics": [
    "local_machine"
   ],
   "proposed": false,
   "evidence": [
    {
     "type": "source",
     "state": "current",
     "revision": "5b3321c7ade4d2e7bed7350c7f054d437035fa9e",
     "path": "README.md",
     "line_start": 134,
     "line_end": 135,
     "symbol": "boxlite",
     "tokens": [
      "boxlite --url http://localhost:8100 list"
     ]
    },
    {
     "type": "source",
     "state": "current",
     "revision": "5b3321c7ade4d2e7bed7350c7f054d437035fa9e",
     "path": "src/cli/src/commands/serve/mod.rs",
     "line_start": 4,
     "line_end": 4,
     "symbol": "Boxlite.rest",
     "tokens": [
      "clients can connect"
     ]
    }
   ]
  },
  {
   "id": "registry",
   "label": "OCI registry",
   "states": [
    "current"
   ],
   "views": [
    "architecture"
   ],
   "topics": [
    "overview",
    "local_machine"
   ],
   "proposed": false,
   "evidence": [
    {
     "type": "source",
     "state": "current",
     "revision": "5b3321c7ade4d2e7bed7350c7f054d437035fa9e",
     "path": "README.md",
     "line_start": 166,
     "line_end": 166,
     "symbol": "Images",
     "tokens": [